{
  "name": "Vintage Warmth",
  "category": "Creative",
  "author": "EzSqueeze",
  "tags": ["vintage", "warm", "character", "transformer", "saturation"],
  "description": "Vintage character compression with transformer impedance. Rich harmonic saturation and gentle dynamics control.",
  "parameters": {
    "threshold": -16,
    "ratio": 3,
    "attack": 10,
    "release": 200,
    "knee": "Medium",
    "makeup": 0,
    "mix": 100,
    "detector": "RMS",
    "lookahead": 0,
    "stereoLink": 100,
    "msMode": false,
    "scHPF": 20,
    "scLPF": 20000,
    "oversampling": 2,
    "ecoMode": false,
    "autoRelease": false,
    "autoMakeup": false,
    "vibeWheel": 80,
    "dualStack": false,
    "cloudGain": 0,
    "impedance": "Transformer",
    "snap": 50,
    "body": 50,
    "deSnap": 0
  }
}
